{
  "$schema": "https://json-schema.org/draft/2020-12/schema",
  "$id": "https://basidiocarp.dev/septa/credential-v1.schema.json",
  "title": "Credential v1",
  "description": "A versioned envelope for credential metadata and references. Tracks credential identity, type, provider, source location, and lifecycle state. Producer: stipe, cortina, operator actions. Consumer: credential managers, auth bootstrap, deployment tools.",
  "type": "object",
  "required": ["schema_version", "credential_id", "credential_type", "provider", "source", "status"],
  "additionalProperties": false,
  "properties": {
    "schema_version": {
      "type": "string",
      "const": "credential-v1",
      "description": "Contract version. Must be 'credential-v1'."
    },
    "credential_id": {
      "type": "string",
      "minLength": 1,
      "description": "Unique identifier for this credential. Examples: 'cred-anthropic-api-01', 'cred-aws-deploy-prod'."
    },
    "credential_type": {
      "type": "string",
      "enum": ["api_key", "oauth_token", "service_account", "bearer_token"],
      "description": "Type of credential. Determines how the credential is handled and refreshed."
    },
    "provider": {
      "type": "string",
      "minLength": 1,
      "description": "The service or system that issued this credential. Examples: 'anthropic', 'aws', 'google', 'github'."
    },
    "scopes": {
      "type": "array",
      "items": {
        "type": "string"
      },
      "description": "List of scopes or permissions this credential grants. Examples: ['messages:write', 'read:user']. Empty array if not applicable."
    },
    "source": {
      "type": "string",
      "enum": ["env", "file", "managed"],
      "description": "Where the credential is stored. 'env' = environment variable, 'file' = file path, 'managed' = managed by external credential store."
    },
    "source_ref": {
      "type": ["string", "null"],
      "description": "Reference to the source location. For 'env', the env var name. For 'file', the file path. For 'managed', a secret ARN or resource identifier. Null if not applicable."
    },
    "status": {
      "type": "string",
      "enum": ["active", "expired", "revoked", "refreshing"],
      "description": "Current lifecycle state of the credential."
    },
    "expires_at": {
      "type": ["string", "null"],
      "format": "date-time",
      "description": "ISO 8601 timestamp when the credential expires. Null if it does not expire."
    },
    "refreshable": {
      "type": "boolean",
      "default": false,
      "description": "Whether this credential can be automatically refreshed (e.g., via refresh token)."
    },
    "last_used_at": {
      "type": ["string", "null"],
      "format": "date-time",
      "description": "ISO 8601 timestamp of the last successful use of this credential. Null if never used."
    },
    "metadata": {
      "type": "object",
      "additionalProperties": true,
      "description": "Optional metadata. May include 'key_id', 'region', 'project_id', 'note', or other producer-specific fields."
    }
  }
}
