{
  "schema_version": "credential-v1",
  "credential_id": "cred-anthropic-api-01",
  "credential_type": "api_key",
  "provider": "anthropic",
  "scopes": ["messages:write"],
  "source": "env",
  "source_ref": "ANTHROPIC_API_KEY",
  "status": "active",
  "expires_at": null,
  "refreshable": false,
  "last_used_at": "2026-04-24T10:00:00Z",
  "metadata": {}
}
